Dataset,Parent figure,Title,x,y,Data source,xmin,xmax,ymin,ymax,Page,Model,Latex.caption,Notes
6.2,yes,,,,,,,,,,,Population of Greater London: best fits based on 1801-1981 (a) and 1801-2001 (b) totals. Data from Morrey (1978) and GLA (2015). ,
6.2.1,6.2,Population of Greater London (a),Year,Population (million),Morrey (1978) and GLA (2015).,1801,2001,0,10,453,Gaussian,Population of Greater London: best fits based on 1801-1981 (a) and 1801-2001 (b) totals. Data from Morrey (1978) and GLA (2015). ,Subfigure of 6.2
6.2.2,6.2,Population of Greater London (b),Year,Population (million),Morrey (1978) and GLA (2015).,1801,2001,0,10,453,Logistic,Population of Greater London: best fits based on 1801-1981 (a) and 1801-2001 (b) totals. Data from Morrey (1978) and GLA (2015). ,Subfigure of 6.2
6.7,,British steel output,Year,Steel production (Mt/year),https://visual.ons.gov.uk/the-british-steel-industry-since-the-1970s,1900,2020,0,30,464,Gaussian,"British steel output, 1900-2020. Fluctuating output reflects economic downturns, expansions, and wars and hence the normal curve is not a particularly close fit ($R^2$ of 0.79). The production peak came in1970, with the 2015 output below the level attained first in 1936. Data from https://visual.ons.gov.uk/the-british-steel-industry-since-the-1970s",
6.9,,American draft horses,Year,Number of US horses (million),USBC (1975),1850,1970,0,25,466,Gaussian,Number of American draft horses between 1850 and 1970 conforms closely to the normal curve trajectory. Data from USBC (1975). ,
6.10,,US steam locomotives,Year,Number of US steam locomotives (thousand),USBC (1975),1850,1970,0,80,467,Gaussian,Number of US steam locomotives: a very good Gaussian fit for the nine decades between 1876 and 1967. Data from USBC (1975). ,
6.11,,US passenger car fleet,Year,Number of US passenger vehicles (million),USBC (1975) and subsequent volumes of US Statistical Abstract,1900,2100,0,250,467,Gaussian,The historical growth of the US passenger car fleet can be fitted quite well into a normal curve peaking around 2030. Data from USBC (1975) and from subsequent volumes of the US Statistical Abstract. ,